{
  "$schema": "https://json-schema.org/draft/2020-12/schema",
  "$id": "https://github.com/Hyuneey/project_saju/data/solar-terms/schema.json",
  "title": "Manse Engine Solar Term Dataset",
  "type": "object",
  "additionalProperties": false,
  "required": [
    "dataVersion",
    "certificationLevel",
    "source",
    "timezone",
    "supportedGregorianYears",
    "terms"
  ],
  "properties": {
    "dataVersion": {
      "type": "string",
      "pattern": "^solar-terms-v\\d+\\.\\d+\\.\\d+$"
    },
    "certificationLevel": {
      "enum": ["seed", "imported-unverified", "cross-checked", "production-certified"]
    },
    "source": {
      "type": "object",
      "additionalProperties": false,
      "required": ["name", "license"],
      "properties": {
        "name": { "type": "string", "minLength": 1 },
        "url": { "type": "string", "format": "uri" },
        "retrievedAt": {
          "type": "string",
          "pattern": "^\\d{4}-\\d{2}-\\d{2}$"
        },
        "license": { "type": "string", "minLength": 1 },
        "notes": { "type": "string" }
      }
    },
    "generatedAt": {
      "type": "string",
      "pattern": "^\\d{4}-\\d{2}-\\d{2}$"
    },
    "timezone": {
      "const": "UTC"
    },
    "supportedGregorianYears": {
      "type": "object",
      "additionalProperties": false,
      "required": ["from", "to"],
      "properties": {
        "from": { "type": "integer", "minimum": 1 },
        "to": { "type": "integer", "minimum": 1 }
      }
    },
    "terms": {
      "type": "array",
      "minItems": 1,
      "items": { "$ref": "#/$defs/SolarTermRecord" }
    }
  },
  "$defs": {
    "SolarTermName": {
      "enum": [
        "lichun",
        "gyeongchip",
        "cheongmyeong",
        "ipha",
        "mangjong",
        "soseo",
        "ipchu",
        "baengno",
        "hanro",
        "ipdong",
        "daeseol",
        "sohan"
      ]
    },
    "SolarTermRecord": {
      "type": "object",
      "additionalProperties": false,
      "required": ["gregorianYear", "name", "nameKo", "hanja", "longitude", "at"],
      "properties": {
        "gregorianYear": { "type": "integer", "minimum": 1 },
        "name": { "$ref": "#/$defs/SolarTermName" },
        "nameKo": { "type": "string", "minLength": 1 },
        "hanja": { "type": "string", "minLength": 1 },
        "longitude": {
          "type": "integer",
          "minimum": 0,
          "maximum": 359
        },
        "at": {
          "type": "string",
          "description": "UTC ISO 8601 boundary datetime. v0.2.2 requires second precision and trailing Z.",
          "pattern": "^\\d{4}-\\d{2}-\\d{2}T\\d{2}:\\d{2}:\\d{2}Z$"
        },
        "source": { "type": "string" }
      }
    }
  }
}
