{
  "dataVersion": "solar-terms-v0.2.1",
  "certificationLevel": "imported-unverified",
  "source": {
    "name": "Wikipedia solar-term Date and Time UTC tables citing JPL Horizons and Skyfield",
    "url": "https://en.wikipedia.org/wiki/Solar_term",
    "retrievedAt": "2026-07-01",
    "license": "CC BY-SA 4.0; upstream table citations include JPL Horizons and Skyfield depending on page/year",
    "notes": "Imported for deterministic engine use and structurally validated. Not independently cross-checked yet, so certificationLevel is imported-unverified."
  },
  "generatedAt": "2026-07-01",
  "timezone": "UTC",
  "supportedGregorianYears": {
    "from": 2015,
    "to": 2026
  },
  "terms": [
    {
      "gregorianYear": 2014,
      "name": "daeseol",
      "nameKo": "대설",
      "hanja": "大雪",
      "longitude": 255,
      "at": "2014-12-07T05:04:00Z",
      "source": "Daxue Date and Time UTC table"
    },
    {
      "gregorianYear": 2015,
      "name": "sohan",
      "nameKo": "소한",
      "hanja": "小寒",
      "longitude": 285,
      "at": "2015-01-05T16:20:00Z",
      "source": "Xiaohan Date and Time UTC table"
    },
    {
      "gregorianYear": 2015,
      "name": "lichun",
      "nameKo": "입춘",
      "hanja": "立春",
      "longitude": 315,
      "at": "2015-02-04T03:58:00Z",
      "source": "Lichun Date and Time UTC table"
    },
    {
      "gregorianYear": 2015,
      "name": "gyeongchip",
      "nameKo": "경칩",
      "hanja": "驚蟄",
      "longitude": 345,
      "at": "2015-03-05T21:55:00Z",
      "source": "Jingzhe Date and Time UTC table"
    },
    {
      "gregorianYear": 2015,
      "name": "cheongmyeong",
      "nameKo": "청명",
      "hanja": "淸明",
      "longitude": 15,
      "at": "2015-04-05T02:39:00Z",
      "source": "Qingming Date and Time UTC table"
    },
    {
      "gregorianYear": 2015,
      "name": "ipha",
      "nameKo": "입하",
      "hanja": "立夏",
      "longitude": 45,
      "at": "2015-05-05T19:52:00Z",
      "source": "Lixia Date and Time UTC table"
    },
    {
      "gregorianYear": 2015,
      "name": "mangjong",
      "nameKo": "망종",
      "hanja": "芒種",
      "longitude": 75,
      "at": "2015-06-05T23:58:00Z",
      "source": "Mangzhong Date and Time UTC table"
    },
    {
      "gregorianYear": 2015,
      "name": "soseo",
      "nameKo": "소서",
      "hanja": "小暑",
      "longitude": 105,
      "at": "2015-07-07T10:12:00Z",
      "source": "Xiaoshu Date and Time UTC table"
    },
    {
      "gregorianYear": 2015,
      "name": "ipchu",
      "nameKo": "입추",
      "hanja": "立秋",
      "longitude": 135,
      "at": "2015-08-07T20:01:00Z",
      "source": "Liqiu Date and Time UTC table"
    },
    {
      "gregorianYear": 2015,
      "name": "baengno",
      "nameKo": "백로",
      "hanja": "白露",
      "longitude": 165,
      "at": "2015-09-07T22:59:00Z",
      "source": "Bailu Date and Time UTC table"
    },
    {
      "gregorianYear": 2015,
      "name": "hanro",
      "nameKo": "한로",
      "hanja": "寒露",
      "longitude": 195,
      "at": "2015-10-08T14:42:00Z",
      "source": "Hanlu Date and Time UTC table"
    },
    {
      "gregorianYear": 2015,
      "name": "ipdong",
      "nameKo": "입동",
      "hanja": "立冬",
      "longitude": 225,
      "at": "2015-11-07T17:58:00Z",
      "source": "Lidong Date and Time UTC table"
    },
    {
      "gregorianYear": 2015,
      "name": "daeseol",
      "nameKo": "대설",
      "hanja": "大雪",
      "longitude": 255,
      "at": "2015-12-07T10:53:00Z",
      "source": "Daxue Date and Time UTC table"
    },
    {
      "gregorianYear": 2016,
      "name": "sohan",
      "nameKo": "소한",
      "hanja": "小寒",
      "longitude": 285,
      "at": "2016-01-05T22:08:00Z",
      "source": "Xiaohan Date and Time UTC table"
    },
    {
      "gregorianYear": 2016,
      "name": "lichun",
      "nameKo": "입춘",
      "hanja": "立春",
      "longitude": 315,
      "at": "2016-02-04T09:46:00Z",
      "source": "Lichun Date and Time UTC table"
    },
    {
      "gregorianYear": 2016,
      "name": "gyeongchip",
      "nameKo": "경칩",
      "hanja": "驚蟄",
      "longitude": 345,
      "at": "2016-03-05T03:43:00Z",
      "source": "Jingzhe Date and Time UTC table"
    },
    {
      "gregorianYear": 2016,
      "name": "cheongmyeong",
      "nameKo": "청명",
      "hanja": "淸明",
      "longitude": 15,
      "at": "2016-04-04T08:27:00Z",
      "source": "Qingming Date and Time UTC table"
    },
    {
      "gregorianYear": 2016,
      "name": "ipha",
      "nameKo": "입하",
      "hanja": "立夏",
      "longitude": 45,
      "at": "2016-05-05T01:41:00Z",
      "source": "Lixia Date and Time UTC table"
    },
    {
      "gregorianYear": 2016,
      "name": "mangjong",
      "nameKo": "망종",
      "hanja": "芒種",
      "longitude": 75,
      "at": "2016-06-05T05:48:00Z",
      "source": "Mangzhong Date and Time UTC table"
    },
    {
      "gregorianYear": 2016,
      "name": "soseo",
      "nameKo": "소서",
      "hanja": "小暑",
      "longitude": 105,
      "at": "2016-07-06T16:03:00Z",
      "source": "Xiaoshu Date and Time UTC table"
    },
    {
      "gregorianYear": 2016,
      "name": "ipchu",
      "nameKo": "입추",
      "hanja": "立秋",
      "longitude": 135,
      "at": "2016-08-07T01:53:00Z",
      "source": "Liqiu Date and Time UTC table"
    },
    {
      "gregorianYear": 2016,
      "name": "baengno",
      "nameKo": "백로",
      "hanja": "白露",
      "longitude": 165,
      "at": "2016-09-07T04:51:00Z",
      "source": "Bailu Date and Time UTC table"
    },
    {
      "gregorianYear": 2016,
      "name": "hanro",
      "nameKo": "한로",
      "hanja": "寒露",
      "longitude": 195,
      "at": "2016-10-07T20:33:00Z",
      "source": "Hanlu Date and Time UTC table"
    },
    {
      "gregorianYear": 2016,
      "name": "ipdong",
      "nameKo": "입동",
      "hanja": "立冬",
      "longitude": 225,
      "at": "2016-11-06T23:47:00Z",
      "source": "Lidong Date and Time UTC table"
    },
    {
      "gregorianYear": 2016,
      "name": "daeseol",
      "nameKo": "대설",
      "hanja": "大雪",
      "longitude": 255,
      "at": "2016-12-06T16:41:00Z",
      "source": "Daxue Date and Time UTC table"
    },
    {
      "gregorianYear": 2017,
      "name": "sohan",
      "nameKo": "소한",
      "hanja": "小寒",
      "longitude": 285,
      "at": "2017-01-05T03:55:00Z",
      "source": "Xiaohan Date and Time UTC table"
    },
    {
      "gregorianYear": 2017,
      "name": "lichun",
      "nameKo": "입춘",
      "hanja": "立春",
      "longitude": 315,
      "at": "2017-02-03T15:34:00Z",
      "source": "Lichun Date and Time UTC table"
    },
    {
      "gregorianYear": 2017,
      "name": "gyeongchip",
      "nameKo": "경칩",
      "hanja": "驚蟄",
      "longitude": 345,
      "at": "2017-03-05T09:32:00Z",
      "source": "Jingzhe Date and Time UTC table"
    },
    {
      "gregorianYear": 2017,
      "name": "cheongmyeong",
      "nameKo": "청명",
      "hanja": "淸明",
      "longitude": 15,
      "at": "2017-04-04T14:17:00Z",
      "source": "Qingming Date and Time UTC table"
    },
    {
      "gregorianYear": 2017,
      "name": "ipha",
      "nameKo": "입하",
      "hanja": "立夏",
      "longitude": 45,
      "at": "2017-05-05T07:31:00Z",
      "source": "Lixia Date and Time UTC table"
    },
    {
      "gregorianYear": 2017,
      "name": "mangjong",
      "nameKo": "망종",
      "hanja": "芒種",
      "longitude": 75,
      "at": "2017-06-05T11:36:00Z",
      "source": "Mangzhong Date and Time UTC table"
    },
    {
      "gregorianYear": 2017,
      "name": "soseo",
      "nameKo": "소서",
      "hanja": "小暑",
      "longitude": 105,
      "at": "2017-07-06T21:50:00Z",
      "source": "Xiaoshu Date and Time UTC table"
    },
    {
      "gregorianYear": 2017,
      "name": "ipchu",
      "nameKo": "입추",
      "hanja": "立秋",
      "longitude": 135,
      "at": "2017-08-07T07:40:00Z",
      "source": "Liqiu Date and Time UTC table"
    },
    {
      "gregorianYear": 2017,
      "name": "baengno",
      "nameKo": "백로",
      "hanja": "白露",
      "longitude": 165,
      "at": "2017-09-07T10:38:00Z",
      "source": "Bailu Date and Time UTC table"
    },
    {
      "gregorianYear": 2017,
      "name": "hanro",
      "nameKo": "한로",
      "hanja": "寒露",
      "longitude": 195,
      "at": "2017-10-08T02:22:00Z",
      "source": "Hanlu Date and Time UTC table"
    },
    {
      "gregorianYear": 2017,
      "name": "ipdong",
      "nameKo": "입동",
      "hanja": "立冬",
      "longitude": 225,
      "at": "2017-11-07T05:37:00Z",
      "source": "Lidong Date and Time UTC table"
    },
    {
      "gregorianYear": 2017,
      "name": "daeseol",
      "nameKo": "대설",
      "hanja": "大雪",
      "longitude": 255,
      "at": "2017-12-06T22:32:00Z",
      "source": "Daxue Date and Time UTC table"
    },
    {
      "gregorianYear": 2018,
      "name": "sohan",
      "nameKo": "소한",
      "hanja": "小寒",
      "longitude": 285,
      "at": "2018-01-05T09:48:00Z",
      "source": "Xiaohan Date and Time UTC table"
    },
    {
      "gregorianYear": 2018,
      "name": "lichun",
      "nameKo": "입춘",
      "hanja": "立春",
      "longitude": 315,
      "at": "2018-02-03T21:28:00Z",
      "source": "Lichun Date and Time UTC table"
    },
    {
      "gregorianYear": 2018,
      "name": "gyeongchip",
      "nameKo": "경칩",
      "hanja": "驚蟄",
      "longitude": 345,
      "at": "2018-03-05T15:28:00Z",
      "source": "Jingzhe Date and Time UTC table"
    },
    {
      "gregorianYear": 2018,
      "name": "cheongmyeong",
      "nameKo": "청명",
      "hanja": "淸明",
      "longitude": 15,
      "at": "2018-04-04T20:12:00Z",
      "source": "Qingming Date and Time UTC table"
    },
    {
      "gregorianYear": 2018,
      "name": "ipha",
      "nameKo": "입하",
      "hanja": "立夏",
      "longitude": 45,
      "at": "2018-05-05T13:25:00Z",
      "source": "Lixia Date and Time UTC table"
    },
    {
      "gregorianYear": 2018,
      "name": "mangjong",
      "nameKo": "망종",
      "hanja": "芒種",